question,answer
"Как дать вторую жизнь старым лыжным очкам?","Сделать рамку для фото, элемент декора в стиле ретро или основу для солнечных очков."
"Что сделать с ненужными пластиковыми бутылками от масла?","Создать лейку, контейнер для хранения сыпучих продуктов или систему полива."
"Как использовать старые кожаные перчатки?","Сделать кошелек, чехол для телефона или элементы декора в стиле стимпанк."
"Что сделать с пустыми тюбиками от зубной пасты?","Использовать как мини-шприц для клея, хранить нитки или сделать дозатор для соусов."
"Как дать вторую жизнь старым конькам?","Сделать держатель для украшений, подставку для ножей или элемент декора."
"Что сделать с ненужными пластиковыми бутылками от воды?","Создать систему хранения круп, кормушку для птиц или мини-теплицу."
"Как использовать старые джинсовые шорты?","Сшить сумку, сделать коврик или чехол для ноутбука."
"Что сделать с битыми стеклянными банками?","Использовать как подсвечники, вазы для сухоцветов или элементы мозаики."
"Как дать вторую жизнь старым теннисным ракеткам?","Сделать зеркало, подставку для сервировки или основу для настенных часов."
"Что сделать с ненужными пластиковыми стаканчиками от йогурта?","Создать систему для рассады, органайзер для мелочей или подставки для карандашей."
"Как использовать старые шерстяные носки?","Сделать грелку для чайника, чехол для стакана или игрушку для кота."
"Что сделать с пустыми тюбиками от косметики?","Хранить в них специи, использовать как мини-контейнеры для путешествий или сделать палитру для красок."
"Как дать вторую жизнь старым лыжным ботинкам?","Сделать кашпо для цветов, оригинальную подставку для зонтов или элемент декора."
"Что сделать с ненужными пластиковыми бутылками от шампуня?","Создать систему хранения инструментов, мини-лейку или контейнер для ниток."
"Как использовать старые вязаные свитера?","Сшить чехол для термоса, сделать теплые тапочки или декоративную гирлянду."
"Что сделать с битыми фарфоровыми блюдцами?","Создать подставки под горячее, элементы мозаики или мини-подсвечники."
"Как дать вторую жизнь старым конькам?","Сделать держатель для ключей, элемент декора в прихожей или основу для светильника."
"Что сделать с ненужными пластиковыми бутылками от молока?","Создать кормушку для птиц, систему полива или контейнеры для хранения инструментов."
"Как использовать старые кожаные ремни?","Сделать ручку для сумки, обивку для табурета или держатель для журналов."
"Что сделать с пустыми тюбиками от клея?","Использовать как дозатор для жидкого мыла, хранить мелкие детали или сделать мини-кисточку."
"Как дать вторую жизнь старым лыжным палкам?","Сделать вешалку, опору для вьющихся растений или ручки для ящиков."
"Что сделать с ненужными пластиковыми контейнерами от мороженого?","Создать систему хранения мелких предметов, мини-горшки для растений или подставки для канцелярии."
"Как использовать старые шерстяные шапки?","Сшить чехол для термоса, сделать теплые варежки или декоративные подушки."
"Что сделать с битыми керамическими кружками?","Создать мозаичное панно, подставки под горячее или элементы садового декора."
"Как дать вторую жизнь старым конькам?","Сделать открывалку для бутылок, вешалку для украшений или элемент интерьера."
"Что сделать с ненужными пластиковыми бутылками от сока?","Создать систему капельного полива, кормушку для птиц или контейнеры для хранения."
"Как использовать старые джинсовые жилеты?","Сшить сумку, сделать чехол для подушки или коврик в прихожую."
"Что сделать с пустыми тюбиками от крема для рук?","Хранить в них бальзам для губ, использовать как мини-контейнер для путешествий или сделать дозатор."
"Как дать вторую жизнь старым лыжным очкам?","Сделать рамку для фото, элемент декора в стиле ретро или основу для солнечных очков."
"Что сделать с ненужными пластиковыми бутылками от моющего средства?","Создать лейку для сада, контейнер для хранения или систему полива комнатных растений."
"Как использовать старые кожаные куртки?","Сшить кошельки, чехлы для гаджетов или сделать обивку для мебели."
"Что сделать с битыми фарфоровыми чайниками?","Создать кашпо для цветов, декоративный светильник или элемент садового декора."
"Как дать вторую жизнь старым теннисным мячам?","Сделать массажер для ног, ножки для стульев или игрушку для собаки."
"Что сделать с ненужными пластиковыми бутылками от воды?","Создать вертикальный сад, систему капельного полива или кормушку для птиц."
"Как использовать старые вязаные шарфы?","Сшить чехол для ноутбука, сделать теплые варежки или декоративную гирлянду."
"Что сделать с пустыми тюбиками от косметики?","Хранить в них специи, использовать как мини-контейнеры для путешествий или сделать палитру для красок."
"Как дать вторую жизнь старым конькам?","Сделать держатель для ключей, элемент декора в прихожей или основу для светильника."
"Что сделать с ненужными пластиковыми бутылками от шампуня?","Создать систему хранения инструментов, мини-лейку или контейнер для ниток."
"Как использовать старые джинсовые шорты?","Сшить сумку, сделать коврик или чехол для ноутбука."
"Что сделать с битыми стеклянными банками?","Использовать как подсвечники, вазы для сухоцветов или элементы мозаики."
"Как дать вторую жизнь старым теннисным ракеткам?","Сделать зеркало, подставку для сервировки или основу для настенных часов."
"Что сделать с ненужными пластиковыми стаканчиками от йогурта?","Создать систему для рассады, органайзер для мелочей или подставки для карандашей."
"Как использовать старые шерстяные носки?","Сделать грелку для чайника, чехол для стакана или игрушку для кота."
"Что сделать с пустыми тюбиками от зубной пасты?","Использовать как мини-шприц для клея, хранить нитки или сделать дозатор для соусов."
"Как дать вторую жизнь старым конькам?","Сделать держатель для украшений, подставку для ножей или элемент декора."
"Что сделать с ненужными пластиковыми бутылками от воды?","Создать систему хранения круп, кормушку для птиц или мини-теплицу."
"Как использовать старые джинсовые куртки?","Сшить сумки, чехлы для подушек или сделать обивку для табурета."
"Что сделать с битыми фарфоровыми блюдцами?","Создать подставки под горячее, элементы мозаики или мини-подсвечники."
"Как дать вторую жизнь старым конькам?","Сделать держатель для ключей, элемент декора в прихожей или основу для светильника."
"Что сделать с ненужными пластиковыми бутылками от молока?","Создать кормушку для птиц, систему полива или контейнеры для хранения инструментов."
"Как использовать старые кожаные ремни?","Сделать ручку для сумки, обивку для табурета или держатель для журналов."
"Что сделать с пустыми тюбиками от клея?","Использовать как дозатор для жидкого мыла, хранить мелкие детали или сделать мини-кисточку."
"Как дать вторую жизнь старым лыжным палкам?","Сделать вешалку, опору для вьющихся растений или ручки для ящиков."
"Что сделать с ненужными пластиковыми контейнерами от мороженого?","Создать систему хранения мелких предметов, мини-горшки для растений или подставки для канцелярии."
"Как использовать старые шерстяные шапки?","Сшить чехол для термоса, сделать теплые варежки или декоративные подушки."
"Что сделать с битыми керамическими кружками?","Создать мозаичное панно, подставки под горячее или элементы садового декора."
"Как дать вторую жизнь старым конькам?","Сделать открывалку для бутылок, вешалку для украшений или элемент интерьера."
"Что сделать с ненужными пластиковыми бутылками от сока?","Создать систему капельного полива, кормушку для птиц или контейнеры для хранения."
"Как использовать старые джинсовые жилеты?","Сшить сумку, сделать чехол для подушки или коврик в прихожую."
"какой самый необычный предмет можно переработать","Удивительно, но старые зубные щётки и тюбики от пасты тоже принимают на переработку в специальных пунктах!"
"что самое странное делают из мусора","Из переработанного пластика делают даже футболки, ковры и... скамейки для парков!"
"знаешь ли ты что-то удивительное про мусор","Каждый год люди выбрасывают столько мусора, что им можно 10 раз заполнить футбольный стадион до крыши!"
"что тебя больше всего удивило в переработке","Факт: стеклянная бутылка разлагается 4000 лет, но может быть переработана мгновенно!"
"расскажи забавный факт о вторсырье","Знаете ли вы, что 700 алюминиевых банок — это велосипед, а 25 пластиковых бутылок — куртка?"
"что смешного в переработке","В Швеции настолько хорошо налажена переработка, что они импортируют мусор из других стран!"  
"что мало кто знает о переработке","Мало кто знает, что наклейки на фруктах (стикеры) — это тоже мусор, который мешает переработке!"
"какой миф о переработке самый распространенный","Самый популярный миф: что грязную упаковку нельзя сдавать. На самом деле её переработают, но лучше мыть!"
"расскажи как сказку про переработку","Жила-была пластиковая бутылка. Её выбросили в жёлтый контейнер, и она превратилась... в красивую куртку!"
"как объяснить ребёнку про мусор","Представь: каждая сданная батарейка — это спасённый ёжик в лесу, который больше не отравится!"
"почему я должен этим заниматься","Каждый раз, сдавая мусор раздельно, ты даёшь вторую жизнь вещам и делаешь планету чище!"
"что я теряю не сортируя мусор","Не сортируя мусор, ты теряешь: 1) деньги (вторсырьё ценится), 2) чистый воздух, 3) своё здоровье"
"как работает завод по переработке","1) Сортировка 2) Очистка 3) Измельчение 4) Плавление 5) Создание новых изделий"
"почему разные пластики сортируют отдельно","Разные виды пластика плавятся при разной температуре — смешивать их нельзя!"
"почему пластиковые бутылки нужно сминать перед сдачей","Это экономит 80% места при транспортировке и хранении."
"какой пластик нельзя перерабатывать","PVC (3), PS (6) и OTHER (7) — они содержат токсичные добавки или сложны в переработке."
"что делают из переработанного алюминия","Новые банки, детали для авто и даже велосипедные рамы."
"почему стеклянные банки нужно сдавать без крышек","Крышки делают из другого материала (металл/пластик), их перерабатывают отдельно."
"как отличить переработанную бумагу","По шероховатой поверхности и сероватому оттенку — в ней нет отбеливателей."
"почему тетрапак не принимают с макулатурой","Это многослойный материал (бумага+алюминий+пластик), требующий особой переработки."
"что означает маркировка 1 на пластике","PET — полиэтилентерефталат, самый распространенный перерабатываемый пластик."
"почему черный пластик не перерабатывают","Черный краситель мешает оптическим датчикам на сортировочных линиях."
"как перерабатывают электронику","Разбирают на компоненты, извлекают драгметаллы, пластик и стекло перерабатывают отдельно."
"почему алюминиевые банки ценятся","Их переплавка экономит 95% энергии compared с производством нового алюминия."
"что такое downcycling","Переработка с понижением качества (например, пластик в синтепон)."
"как работает химическая переработка пластика","Пластик расщепляют на молекулы, получая сырьё для нового производства."
"что такое прессование отходов","Уплотнение мусора в брикеты для удобства транспортировки."
"как сортируют мусор на заводе","Магниты — металл, воздушные потоки — лёгкие материалы, ИИ-камеры — типы пластика."
"почему переработка бумаги требует воды","Чтобы отделить волокна целлюлозы от краски и примесей."
"что такое грануляция пластика","Расплавленный пластик нарезают на гранулы для нового производства."
"как перерабатывают органические отходы","Компостирование или биогазовые установки."
"что делают с неперерабатываемым мусором","Захоронение на полигонах или сжигание с получением энергии."
"почему переработка стекла экологична","Не требует химикатов и сохраняет 100% свойств материала."
"что такое zero waste","Концепция безотходного образа жизни через reuse-reduce-recycle."
"сколько нефти экономит переработка 1 тонны пластика","Около 800 кг нефти."
"как мусор влияет на океаны","Ежегодно 8 млн тонн пластика убивают 100 тыс. морских животных."
"почему свалки опасны для климата","Выделяют метан — газ с парниковым эффектом в 25 раз сильнее CO₂."
"сколько деревьев спасает тонна макулатуры","17 взрослых деревьев."
"почему батарейки нельзя выбрасывать","Одна батарейка загрязняет 20 м² земли тяжёлыми металлами."
"как долго разлагается пластик","450-1000 лет в зависимости от типа."
"что такое микропластик","Частицы меньше 5 мм, накапливающиеся в воде и организме человека."
"почему сжигание мусора вредно","Выделяет диоксины, вызывающие рак и мутации."
"как отходы влияют на здоровье","Токсины попадают в воду/воздух, вызывая аллергии и болезни лёгких."
"что такое углеродный след мусора","Количество CO₂, выделяемое при производстве и утилизации товара."
"какую страну называют королём переработки","Швецию — они перерабатывают 99% отходов и импортируют мусор."
"что делают из переработанных покрышек","Беговые дорожки, футбольные поля и асфальт."
"как грибы помогают переработке","Некоторые виды разлагают пластик за 3 месяца."
"что такое пластиковые дороги","Дороги из переработанного пластика в 10 раз долговечнее асфальта."
"как дроны следят за свалками","Обнаруживают незаконные свалки с помощью тепловизоров."
"что делают из переработанных рыболовных сетей","Ковры, спортивную одежду и даже очки."
"как блокчейн используют в переработке","Для отслеживания цепочки движения вторсырья."
"что такое эко-кирпичи","Пластиковые бутылки, набитые другим мусором для строительства."
"как ИИ сортирует мусор","Нейросети распознают типы материалов с точностью до 95%."
"что делают из переработанных CD-дисков","Солнечные панели и детали для автомобилей."
"что такое расширенная ответственность производителей","Обязанность компаний утилизировать упаковку своих товаров."
"как работает залоговая система","Доплата за тару, возвращаемая при сдаче на переработку."
"что такое экологический сбор","Платеж производителей на развитие перерабатывающей инфраструктуры."
"как организовать раздельный сбор в офисе","Поставить контейнеры с понятной маркировкой и инструкцией."
"что такое greenwashing","Обман о "экологичности" продукта без реальных оснований."
"как отличить биоразлагаемый пластик","Ищите маркировки: OK compost, Seedling или ГОСТ Р 54530-2011."
"почему в Японии 10+ категорий мусора","Для максимального извлечения вторсырья — их уровень переработки 65%."
"что такое жизненный цикл продукта","Анализ эковоздействия от производства до утилизации."
"как работают фандоматы","Автоматы принимают тару, взвешивают и выдают вознаграждение."
"что такое RDF-топливо","Топливо из отходов для цементных заводов."
"как сделать компост на балконе","Используйте герметичный контейнер с бактериями и регулярно перемешивайте."
