question,answer
"Почему важно сдавать одежду отдельно?","Текстиль разлагается 200+ лет, а 95% можно переработать или использовать повторно."
"Что такое greenwashing?","Введение в заблуждение об экологичности продукта без реальных оснований."
"Как определить экологичную упаковку?","Ищите маркировки FSC (ответственная лесозаготовка), экомаркировки I типа."
"Что такое циклическая экономика?","Модель экономики, где отходы становятся ресурсом для нового производства."
"Почему важно снимать пробки с бутылок?","Пробки делают из другого материала, который перерабатывается отдельно."
"Что такое жизненный цикл продукта?","Все этапы от добычи сырья до утилизации, учитывающие экологическое воздействие."
"Как работает система EPR?","Extended Producer Responsibility - ответственность производителя за утилизацию своей продукции."
"Что такое экослед товара?","Мера воздействия товара на окружающую среду на всех этапах его жизненного цикла."
"Почему важно сокращать отходы?","Снижает нагрузку на полигоны, экономит ресурсы и уменьшает загрязнение."
"Что такое устойчивое потребление?","Осознанное потребление с учетом экологических и социальных последствий."
"Как определить действительно экологичный продукт?","По наличию независимых экомаркировок (ЕС Ecolabel, Листок жизни и др.)."
"Что такое принцип 3R?","Reduce (сокращение), Reuse (повторное использование), Recycle (переработка)."
"Почему важно участвовать в раздельном сборе?","Это увеличивает процент переработки и снижает объемы захоронения отходов."
"Что такое углеродная нейтральность?","Баланс между выбросами углерода и их поглощением из атмосферы."
"Как работает система возвратной тары?","Многоразовая тара возвращается производителю для повторного использования."
"Что такое экологический менеджмент?","Система управления предприятием, направленная на снижение экологического вреда."
"Правда ли, что переработка одной алюминиевой банки экономит энергию для работы телевизора 3 часа?","Да! Переработка алюминия экономит 95% энергии по сравнению с производством нового."
"Сколько лет разлагается пластиковая бутылка?","450–500 лет, но переработка превращает её в новую вещь за 2 месяца!"
"Почему океан называют «пластиковым супом»?","Из-за 5 триллионов пластиковых частиц, плавающих в воде — это в 500 раз больше, чем звёзд в Млечном Пути."
"Могут ли черви есть пластик?","Да! Учёные обнаружили бактерии и мучных червей, которые разлагают пластик на безопасные вещества."
"Зачем мне сортировать мусор, если другие не делают этого?","Каждый, кто сортирует отходы, сокращает свалки на 30–50%. Ваш пример вдохновит других!"
"Почему раздельный сбор — это не сложно?","Это как научиться чистить зубы: первые 2 недели непривычно, потом — легко и даже приятно!"
"Что я теряю, если не сортирую мусор?","Деньги (налоги на свалки растут), здоровье (токсины с полигонов попадают в воздух) и будущее планеты."
"Правда ли, что экопривычки делают людей счастливее?","Да! Исследования показывают: осознанность снижает тревожность и даёт чувство вклада в общее дело."
"Куда деть старую зубную щётку?","Сделайте из неё щётку для чистки обуви или кисточку для рисования!"
"Как использовать пустые тетрапаки?","Разрежьте — получится горшок для рассады или кормушка для птиц."
"Что делать с битыми зеркалами?","Из осколков можно сделать мозаику или сдать в пункт приёма стекла (упаковав в картон)."
"Как дать вторую жизнь капроновым колготкам?","Используйте как фильтр для воды в походе или материал для вязания (капрон не рвётся!)."
"Правда ли, что весь собранный пластик сжигают?","Нет! В Европе перерабатывают 40% пластика, в России — пока 12%, но цифры растут благодаря раздельному сбору."
"Будут ли перерабатывать мой мусор, если я его рассортирую?","Да! Если вымыть и правильно сдать — 90% отходов станут новыми вещами. Например, 25 бутылок = 1 флисовая куртка."
"Разве свалки не решают проблему?","Нет. 1 га свалки отравляет 10 га земли вокруг. А переработка создаёт рабочие места и экономит ресурсы."
"Какие страны лидируют в переработке?","Швеция (99% отходов перерабатывают), Германия (68%), Южная Корея (59%). Россия — на 45-м месте, но мы можем улучшить статистику!"
"Кто делает крутые вещи из мусора?","Бренд Adidas — кроссовки из океанского пластика, IKEA — мебель из переработанного дерева."
"Как дети меняют мир?","Школьник из Индии придумал как делать кирпичи из пластика — теперь его дома спасают людей от наводнений."
"Что будет, если все начнут сортировать мусор?","Свалки сократятся на 80%, воздух станет чище, а нефти хватит на 100+ лет дольше."
"Почему Земля — это космический корабль?","У нас нет «запасной планеты» — все ресурсы ограничены, а переработка продлевает жизнь корабля."
"Как мусор связан с войнами?","Борьба за нефть (сырьё для пластика) и чистую воду будет обостряться, если не сокращать отходы."
"Можно ли построить дом из мусора?","Да! В Японии есть остров из переработанных отходов, где живут 1.5 млн человек."
"Что сказала бы бутылка, если бы могла говорить?","«Не бросай меня! Я могу стать твоей новой футболкой»."
"Как объяснить коту, что мусор надо сортировать?","Коту — сложно. Но если вы будете делать это, он скопирует вашу привычку (проверено!)."
"Что такое «пластиковые дороги»?","В Индии и Голландии строят дороги из переработанного пластика — они прочнее асфальта и не трескаются."
"Как ИИ помогает переработке?","Роботы-сортировщики с искусственным интеллектом разбирают мусор в 10 раз быстрее людей."
"Будут ли батарейки из грибов?","Уже тестируют! Мицелий разлагает токсины в батарейках — возможно, скоро они станут экологичными."
"Знаете ли вы, что...","Из 400 алюминиевых банок можно сделать детский велосипед!"
"Интересный факт о стекле","Переработанное стекло плавится при более низкой температуре, экономя энергию"
"Что необычного можно сделать из пластиковых бутылок?","Из 25 бутылок можно сделать флисовую куртку"
"Правда ли, что...","Старые джинсы могут стать утеплителем для дома - да, это технология деним-изоляции!"
"Как дать вторую жизнь CD-дискам?","Их можно превратить в светоотражатели для велосипедов или мозаику"
"Что сделать из старой стиральной машины?","Барабан может стать оригинальным столиком или камином"
"Идея для винных пробок","Из них получаются отличные подставки под горячее или доска для заметок"
"Как использовать старые газеты?","Их можно превратить в экологичную упаковку для подарков"
"Когда появилась первая программа переработки?","Еще в 1031 году в Японии перерабатывали бумагу"
"Как боролись с мусором в Древнем Риме?","Организовывали специальные свалки за городом и повторно использовали амфоры"
"Когда изобрели пластик?","Первый искусственный пластик создали в 1855 году"
"Какие новые технологии переработки появились?","Ученые создали ферменты, которые полностью разлагают пластик за 24 часа"
"Что такое химическая переработка?","Это процесс превращения пластика обратно в нефть для нового производства"
"Как грибы помогают переработке?","Некоторые виды грибов могут разлагать пластик и очищать почву"
"Как мусор влияет на океаны?","Каждую минуту в океан попадает мусоровоз пластика"
"Что такое Большое тихоокеанское мусорное пятно?","Это скопление мусора площадью в 3 Франции, плавающее в океане"
"Как отходы влияют на климат?","Свалки производят 20% мировых выбросов метана"
"Как мой выбор влияет на планету?","Сортируя отходы 1 год, вы спасаете 10 кв.м земли от свалки"
"Почему стоит начать сегодня?","Каждая переработанная бутылка - это на 25% меньше нефти в мире"
"Как объяснить детям важность переработки?","Скажите: 'Это как Лего - из старых деталей можно построить что-то новое!'"
"Что такое экономика замкнутого цикла?","Это система, где отходы становятся ресурсом для нового производства"
"Какие профессии появятся в переработке?","Дизайнеры экопродукции, инженеры по переработке, экологичные технологи"
"Как будет выглядеть переработка в 2050 году?","Умные контейнеры с ИИ будут автоматически сортировать наши отходы"
"Можно ли переработать воздушные шары?","Нет, они очень опасны для животных - лучше использовать бумажные гирлянды"
"Что делать с использованными салфетками?","Их нельзя переработать, но можно компостировать (если нет синтетических волокон)"
"Как утилизировать старые фотографии?","Их нельзя переработать с бумагой - лучше отправить в специальные пункты приема"
"Как перерабатывают в Арктике?","Там используют специальные установки, прессующие мусор для дальнейшего вывоза"
"Что делает Швеция с мусором?","Импортирует отходы из других стран для своих мусоросжигательных заводов"
"Как в Японии сортируют отходы?","Некоторые города требуют разделения на 10+ категорий"
"Кто создает искусство из мусора?","Художники like Artur Bordalo делают огромные скульптуры из отходов"
"Как проводят модные показы из вторсырья?","Дизайнеры создают коллекции из переработанных материалов"
"Что такое трэш-арт?","Это направление искусства, где произведения создают из отходов"
"Как дроны помогают переработке?","Они обследуют свалки и находят пригодные для переработки материалы"
"Что такое умные мусорные баки?","Они взвешивают отходы и сообщают, когда заполнены"
"Как блокчейн используется в переработке?","Для отслеживания цепочки переработки материалов"
"Почему мы называем это 'мусором'?","Потому что не видим ценности в использованных материалах"
"Что важнее - переработка или сокращение отходов?","Сокращение - но переработка нужна для того, что уже произведено"
"Как изменится мир, если все начнут перерабатывать?","Мы сократим свалки на 75% и сохраним ресурсы для будущих поколений"
"Какой закон регулирует обращение с отходами производства и потребления в РФ?","Федеральный закон от 24.06.1998 N 89-ФЗ «Об отходах производства и потребления»."
"Какие основные понятия используются в Федеральном законе об отходах?","Отходы производства и потребления, обращение с отходами, размещение отходов, утилизация, обезвреживание и другие."
"Какие классы опасности отходов установлены законом?","I класс — чрезвычайно опасные, II класс — высокоопасные, III класс — умеренно опасные, IV класс — малоопасные, V класс — практически неопасные."
"Какие принципы государственной политики в области обращения с отходами?","Охрана здоровья человека, поддержание благоприятной окружающей среды, использование наилучших доступных технологий."
"Какие направления государственной политики являются приоритетными?","Максимальное использование сырья, предотвращение образования отходов, сокращение их количества, обработка, утилизация, обезвреживание."
"Кто определяет право собственности на отходы?","Право собственности определяется в соответствии с гражданским законодательством."
"Какие полномочия имеет РФ в области обращения с отходами?","Разработка законов, проведение государственной политики, лицензирование деятельности, установление нормативов."
"Какие полномочия имеют субъекты РФ в области обращения с отходами?","Разработка региональных программ, государственный надзор, установление нормативов образования отходов."
"Какие полномочия имеют органы местного самоуправления?","Создание мест накопления отходов, организация экологического воспитания, определение схем размещения отходов."
"Какие требования предъявляются к объектам размещения отходов?","Запрещено размещение отходов на объектах, не внесенных в государственный реестр, и в запрещенных зонах."
"Какие требования к транспортированию отходов?","Наличие паспорта отходов, специально оборудованных транспортных средств, соблюдение требований безопасности."
"Какие требования к обращению с отходами I-IV классов опасности?","Необходимо подтверждение класса опасности, паспортизация отходов, соблюдение требований при обращении."
"Какие требования к лицам, работающим с отходами I-IV классов опасности?","Наличие документов о квалификации, профессиональное обучение, ответственность должностных лиц."
"Какие запреты установлены на ввоз отходов?","Запрещен ввоз отходов на территорию РФ для захоронения и обезвреживания."
"Какие требования к нормированию в области обращения с отходами?","Установление нормативов образования отходов и лимитов на их размещение для юридических лиц и ИП."
"Какие объекты подлежат государственному учету?","Объекты размещения отходов, включенные в государственный реестр."
"Какие требования к обращению с ломом и отходами металлов?","Необходимы документы, подтверждающие право собственности, и соблюдение правил обращения."
"Какие требования к территориальным схемам обращения с отходами?","Схемы должны включать данные об источниках образования отходов, их количестве, местах накопления."
"Какие требования к местам накопления отходов?","Накопление допускается только в специально оборудованных местах, соответствующих законодательству."
"Какие требования к региональным программам в области обращения с отходами?","Программы должны содержать целевые показатели, перечень мероприятий, источники финансирования."
"Какие требования к обращению с твердыми коммунальными отходами?","Организация их сбора, транспортирования, обработки, утилизации, обезвреживания и захоронения."
"Какие требования к эксплуатации объектов, связанных с отходами?","Соблюдение федеральных норм, внедрение малоотходных технологий, проведение мониторинга."
"Какие требования к архитектурно-строительному проектированию?","Необходимо предусматривать места накопления отходов в соответствии с нормами."
"Какие требования к лицензированию деятельности по обращению с отходами?","Лицензирование осуществляется в соответствии с Федеральным законом от 04.05.2011 N 99-ФЗ."
"Какие требования к обращению с радиоактивными отходами?","Регулируются соответствующим законодательством РФ, не подпадающим под действие закона об отходах."
"Какие требования к обращению с биологическими отходами?","Регулируются соответствующим законодательством РФ, не подпадающим под действие закона об отходах."
"Какие требования к обращению с медицинскими отходами?","Регулируются соответствующим законодательством РФ, не подпадающим под действие закона об отходах."
"Какие требования к обращению с озоноразрушающими веществами?","Регулируются соответствующим законодательством РФ, не подпадающим под действие закона об отходах."
"Какие требования к обращению с выбросами вредных веществ?","Регулируются соответствующим законодательством РФ, не подпадающим под действие закона об отходах."
"Какие требования к обращению со сбросами вредных веществ?","Регулируются соответствующим законодательством РФ, не подпадающим под действие закона об отходах."
